{
  "schema_version": 1,
  "run_id": "phase3-auth-completion",
  "created_at": "2026-10-08T21:49:12.3355866+09:00",
  "objective": "Phase 3 Web/PWA 인증 완료 및 계정 삭제 흐름 구현",
  "acceptance_criteria": [
    "이메일/Google 인증, 세션 상태 관리, 계정 삭제(데이터/Storage 정리) 구현 및 단위 테스트 통과"
  ],
  "base_sha": "268b1be07a920010aa9e5a8a678de68694b41829",
  "target_sha": "39a116eac8dfd43cc8540b219c7b4148eb2cf9a9",
  "branch": "collab/phase3-auth-completion",
  "worktree_path": ".worktrees/phase3-auth-completion",
  "max_iterations": 3,
  "status": "in_progress"
}
