{
  "schema_version": 1,
  "run_id": "phase1-completion",
  "created_at": "2026-10-08T12:01:33.0415667+00:00",
  "objective": "Complete and verify Phase 1 Web/PWA setup and test infrastructure",
  "acceptance_criteria": [
    "1. Next.js static export build (npm run build) succeeds without errors.",
    "2. Vitest runs all tests successfully (npm run test).",
    "3. Required shadcn/ui components (Dialog, Select, Progress, Drawer) are installed and available.",
    "4. Supabase browser client singleton is configured correctly."
  ],
  "base_sha": "ea981a96e0044e0e8e0e770dcb79151df9d42d39",
  "target_sha": "0ea0a9914b7947f9e1fb7d5302fcaccfff86b5ba",
  "branch": "collab/phase1-completion",
  "worktree_path": ".worktrees/phase1-completion",
  "max_iterations": 3,
  "status": "completed"
}
