{
  "schema_version": 1,
  "run_id": "phase1-setup",
  "created_at": "2026-10-02T12:37:26.7249923+00:00",
  "objective": "Phase 1 환경 세팅, 테스트 인프라 및 Tauri 스파이크",
  "acceptance_criteria": [
    "npm run build가 에러 없이 실행되고 out/ 디렉터리가 생성된다",
    "npm run test가 100% 통과한다",
    "Tauri 데스크톱 앱이 정상적으로 빌드 및 실행된다",
    "shadcn/ui 컴포넌트가 렌더링된다",
    "Supabase 클라이언트가 에러 없이 초기화된다"
  ],
  "base_sha": "2ab2ebaac10bf7be6faee4770d108c6acbaf760f",
  "target_sha": "dda0cae9a13fe6cd7769fcb77a83167b92cb65b5",
  "branch": "collab/phase1-setup",
  "worktree_path": ".worktrees/phase1-setup",
  "max_iterations": 3,
  "status": "in_progress"
}
