{
    "schema_version":  1,
    "run_id":  "phase5-calendar-core",
    "created_at":  "2026-10-08T13:25:41.1364959+00:00",
    "objective":  "Phase 5 미니멀 캘린더 코어, 개인 메모 및 Lazy Generation 구현",
    "acceptance_criteria":  [
                                "5.1 날짜 연산, 5.2 Lazy Generation, 5.3 데스크톱 캘린더, 5.4 모바일 사이드바/바텀시트 구현 및 테스트 통과"
                            ],
    "base_sha":  "3cc589e0b2f9f6d628709eb77f507c776034828f",
    "target_sha":  null,
    "branch":  "collab/phase5-calendar-core",
    "worktree_path":  ".worktrees/phase5-calendar-core",
    "max_iterations":  3,
    "status":  "in_progress"
}
