{
  "schema_version": 1,
  "run_id": "phase8-ui-polishing",
  "created_at": "2026-10-08T15:21:27.4310965+00:00",
  "objective": "Phase 8 UI/UX Polishing",
  "acceptance_criteria": [
    "Apply A2Z font globally",
    "Apply Cool Neutral Light and Dark palettes",
    "Refine component spacing, shadows, and responsive layout according to design specs"
  ],
  "base_sha": "7a9cf2f9c6367b221287adb8ccf6e2d84d94cfa5",
  "target_sha": "5171d89c997b54b87c95f7824628b1b8af601bb4",
  "branch": "collab/phase8-ui-polishing",
  "worktree_path": ".worktrees/phase8-ui-polishing",
  "max_iterations": 3,
  "status": "completed"
}
